{
  "type": "bundle",
  "id": "bundle--bf35a4b5-e102-463d-9105-4d7a6e2d78bc",
  "spec_version": "2.0",
  "objects": [
    {
      "type": "campaign",
      "id": "campaign--c831ab93-ff84-9cda-2bd8-b094004da969",
      "created": "2014-02-20T09:00:00.000000Z",
      "modified": "2014-02-20T09:00:00.000000Z",
      "name": "Operation Alpha"
    },
    {
      "type": "relationship",
      "id": "relationship--81c279d9-c30e-4d12-8412-39192384efe7",
      "created": "2014-02-20T09:00:00.000000Z",
      "modified": "2014-02-20T09:00:00.000000Z",
      "relationship_type": "targets",
      "source_ref": "campaign--c831ab93-ff84-9cda-2bd8-b094004da969",
      "target_ref": "identity--4fde045a-b25f-f035-e8d0-29c9d5130cd9"
    },
    {
      "type": "identity",
      "id": "identity--4fde045a-b25f-f035-e8d0-29c9d5130cd9",      
      "created": "2014-02-20T09:00:00.000000Z",
      "modified": "2014-02-20T09:00:00.000000Z",
      "name": "Financial Service Customers",
      "identity_class": "group",
      "sectors": [
        "financial-services"
      ]
    }
  ]
}
